{"captured_at":"2026-08-19T08:07:15Z","content_hash":"sha256:a32c6a0c3be255adf7863ba6fd8a5bf1c61c42697c23d7568d843e49e5234053","currency":"USD","input_microusd_per_million_tokens":250000,"model_identifier":"gpt-5-mini","output_microusd_per_million_tokens":2000000,"provider":"openai","schema_version":"1.0.0","snapshot_id":"pricing.openai.gpt5-mini.2026-08-19.v1","source":"https://developers.openai.com/api/docs/models/gpt-5-mini","units":"micro-USD per 1,000,000 tokens"}
